review_id,user_id,product_id,rating,review_date,review_text
1,301,87,5,2025-12-09,Sort hair amount wonder these we wide reveal sure power prevent news team purpose.
2,453,76,4,2025-12-09,Themselves near become city consumer employee wall he local mention eye house knowledge participant strategy story store bank.
3,384,23,4,2025-12-09,Visit parent ask low have check quality everyone benefit fill sit fund public investment every must mind pull each sister from now evening.
4,103,41,5,2025-12-09,Go sister old already affect for rise enjoy soldier decision structure development she Mr price big teacher song company cell.
5,407,107,4,2025-12-09,Enter partner today main water really fear both decision order level yes professional body wear poor left teach short pass enjoy production stand process.
6,108,143,1,2025-12-09,Card good half while front effort development establish whom plant finally hour forget possible life people finish down certain happen health.
7,134,92,2,2025-12-09,Street purpose old whose general section feeling maintain up best impact.
8,441,129,1,2025-12-09,Skin travel significant energy policy since improve draw score pretty while few ability adult.
9,59,59,1,2025-12-09,Hundred or wish plant benefit role manage operation result southern really wind buy glass floor future.
10,175,91,1,2025-12-09,Require material exist research I but agent part home affect least past all suffer serious just along himself of position off major.
11,26,113,4,2025-12-09,Concern more finish better tough choose see half special door near social one knowledge quality good cup investment yourself happy purpose green money imagine.
12,288,11,5,2025-12-09,Lawyer car Mrs establish be degree song star send partner avoid couple.
13,323,31,2,2025-12-09,Treat finally manage finally pass it surface type finish Republican road increase shoulder this week environmental white cultural should wind property.
14,150,114,5,2025-12-09,Purpose direction hair pick such night check station message window garden we protect down role special watch remain son center media.
15,446,26,2,2025-12-09,Investment on because call campaign cultural sort away phone coach term source bar board majority politics nothing without successful.
16,71,32,2,2025-12-09,Hour serve five white pick evening trip record Congress rather first expert baby minute something reach program.
17,213,2,2,2025-12-09,Degree TV could whom reach certain deal stay poor beyond or know.
18,147,130,2,2025-12-09,Feeling between single evidence market bag high care agreement avoid product during drug environment arrive best continue college debate home crime meet.
19,191,107,3,2025-12-09,Light lot run action instead professor itself will down let certain page able inside lot stuff PM.
20,386,136,4,2025-12-09,Material among nation suffer house any feel may sport develop difficult still.
21,220,106,4,2025-12-09,Suddenly pressure somebody either investment fear open bar already responsibility range discuss race hit treatment somebody notice whole rest.
22,350,93,1,2025-12-09,Director candidate sport your relate other radio but attorney tell.
23,395,3,5,2025-12-09,Between however nation often let action everyone brother forward east out point huge catch themselves weight husband about company interest same series nearly.
24,162,103,2,2025-12-09,Happen everybody action ten up discussion significant happy discuss me fear radio perform bar impact large those for be find truth.
25,202,10,2,2025-12-09,Design real generation ago clear bank another space because treat each beautiful form message play religious not activity determine space television law manage.
26,324,134,3,2025-12-09,Tax recognize court generation matter traditional throw field can travel recognize above.
27,454,142,3,2025-12-09,Effect speak set piece opportunity decade large next boy newspaper shake identify let project tax act evidence financial walk.
28,177,3,3,2025-12-09,Sometimes lawyer play success successful police line door direction computer oil inside stock rise four sense matter woman yes future single few exactly mouth.
29,207,115,2,2025-12-09,Field their keep soon such must yard hit task suddenly class anything organization support through growth often threat sort including bring blue machine year.
30,177,104,2,2025-12-09,Fill last face sea industry leave memory so charge hold office fast full wall quite serve oil participant election.
31,276,86,4,2025-12-09,Teach score activity its rich rock consider tend practice television attack mind use site live person television third three keep hear American.
32,277,73,2,2025-12-09,Notice throw image heavy market operation these space type attorney size area just draw group.
33,283,80,5,2025-12-09,Others common produce allow much too trouble explain clearly cover walk drop skin democratic operation discover evidence against husband remain agree summer way.
34,326,41,1,2025-12-09,Remain quite able partner pressure course join they follow cell figure carry gas lot strong almost.
35,408,139,5,2025-12-09,Effect though new expert long water early bring official send son situation eight gun white toward.
36,427,78,4,2025-12-09,Food window improve year wife half song look teacher week.
37,31,96,3,2025-12-09,Point land however quickly among reveal week collection eat avoid lose top behavior why tough nice who two week simply product music.
38,25,32,4,2025-12-09,Modern low turn mind data something baby soon south note something community stage listen project hot feel interview doctor set my media likely.
39,378,2,4,2025-12-09,Bad among money fine range change again race room prevent about rich major father water at every marriage.
40,121,149,5,2025-12-09,Area thousand image capital letter practice adult best commercial race number education.
41,154,73,5,2025-12-09,Discover return area movement short factor myself voice country add whose.
42,127,27,3,2025-12-09,Center draw new huge religious action any because employee knowledge organization director husband away score mother matter between plant according half reveal.
43,99,93,4,2025-12-09,Many wonder wish protect agree can available candidate budget none near result call dinner change north success story offer surface.
44,365,109,4,2025-12-09,Future claim travel gas who place head follow by investment decision page kitchen executive close affect skin free view few teacher yet white trip.
45,32,109,2,2025-12-09,Specific step old citizen candidate over military nation really concern president weight whose trip road dog under its smile lose think election course.
46,229,20,3,2025-12-09,Picture garden fight to million close window heavy live front image represent film thus term.
47,287,133,4,2025-12-09,Strong party number several difficult up positive political by likely ten.
48,84,37,5,2025-12-09,Air anyone expert over industry great direction indeed explain cold high single really catch hand order type determine site discuss other be whatever type picture.
49,365,118,2,2025-12-09,Quickly chance drop want box least standard how treatment else whether foreign.
50,271,31,2,2025-12-09,These plant miss call particular development without particularly world evening.
51,17,41,5,2025-12-09,Citizen much drug soldier seven seven pattern range treatment loss live various work eat.
52,488,31,5,2025-12-09,Smile coach shoulder clear feeling rock door foot amount dark painting.
53,190,147,3,2025-12-09,Also will area feel law attack subject find certainly me economic scene foot employee voice research exist political by people out right seek.
54,79,31,3,2025-12-09,Wear specific environment number perform figure discuss off onto everyone table school public tend social read company light really free.
55,192,78,3,2025-12-09,Still step better determine after loss everyone eat together quickly anything worry institution big condition fall.
56,406,37,2,2025-12-09,Against now hear research learn area discover and trouble hundred by start force standard maintain bed.
57,480,79,3,2025-12-09,Move material sound what environment young appear charge time stand push watch hotel author order choose spend task.
58,420,126,1,2025-12-09,Discussion song along main might only such state run though tough glass sea role financial which use wind.
59,179,18,1,2025-12-09,Body reality teach finish many building use it discover when place capital everyone early style issue seat care system provide their.
60,294,80,5,2025-12-09,Through respond down capital them a job available among child fire none history speak property information knowledge theory fill.
61,173,97,4,2025-12-09,Agency value among she also analysis trouble she individual benefit anyone describe chance store modern newspaper Mrs debate exactly wind.
62,71,130,4,2025-12-09,History during mission imagine meet remain safe become stage good inside other year.
63,373,84,1,2025-12-09,Produce high year serve movie civil long model activity we research.
64,120,102,3,2025-12-09,Right work both protect ten language place leader goal executive.
65,491,114,3,2025-12-09,Development right sit where develop shoulder page weight minute out pick now billion effort with parent daughter left bag hold enjoy along.
66,287,22,2,2025-12-09,Money rich last attention night several throw base fight issue go parent half I young eat seek mean trouble.
67,388,14,5,2025-12-09,Decide use administration allow glass strong get former social drive like live some adult customer her reach loss option claim.
68,385,122,5,2025-12-09,He natural pull actually billion enjoy arm west western face fly probably you.
69,480,137,2,2025-12-09,Yeah medical season already nor truth successful nothing many piece down member career help hot actually sometimes sign eat detail provide agree oil fact.
70,106,63,5,2025-12-09,Past peace difficult adult reality research blood yard not popular finish even senior check.
71,414,137,5,2025-12-09,Really grow miss sometimes church front laugh force identify above camera also difference west although him life table wish bill growth process.
72,302,12,4,2025-12-09,Say step bill might pick sign medical traditional front include issue report song sure design camera money family every play almost news son.
73,224,47,4,2025-12-09,For list particularly stop special talk example field address civil with really.
74,271,82,4,2025-12-09,Mr student course audience than doctor baby happen difficult available structure body mouth receive herself herself.
75,59,26,5,2025-12-09,Turn small page eat off according be enough us small them nothing season.
76,74,47,3,2025-12-09,Sound past safe suggest her price out thousand risk important need since face why determine bad behavior sense middle book tax talk plant fine.
77,488,105,2,2025-12-09,Recently discuss fire break them protect finally late maybe increase occur ever.
78,493,84,2,2025-12-09,Law fast stage learn defense against bit speak government treat even listen watch check foreign with outside so lawyer.
79,30,77,4,2025-12-09,Development tax visit enter peace oil TV moment about wall east.
80,73,106,3,2025-12-09,Hotel wide past become staff identify feel above history difference interview speak go wait reflect news.
81,483,31,1,2025-12-09,Understand however because student ball you owner popular far skill close difficult also use again exactly fact minute less feel no.
82,386,61,4,2025-12-09,Staff opportunity meeting might level together east space agent approach throughout something about author main what technology president finish traditional other speak staff various.
83,259,99,1,2025-12-09,Billion use available blood region institution appear already pattern color behavior expert beat will ground support institution evidence discussion program million professional.
84,163,119,5,2025-12-09,Hear class nothing board simply ago decision doctor during ability view area pay someone on his identify girl.
85,248,8,4,2025-12-09,Whatever party positive lead billion lawyer which than shake reason choice media response.
86,284,26,2,2025-12-09,Society speech state suffer heavy form product structure check look speech network professional end back.
87,291,105,4,2025-12-09,Office social thus loss participant key almost accept hair political local director floor parent budget response home.
88,326,129,2,2025-12-09,Hotel specific newspaper could theory seek hotel husband standard movement other.
89,277,44,2,2025-12-09,Voice production pick foreign magazine suggest discuss response economy car receive word right.
90,217,143,4,2025-12-09,West on character focus page system area agency under hope approach answer bag when standard project seek bar force.
91,417,119,5,2025-12-09,Audience one court election education side perhaps method cause because discuss another science mention pretty cover table program heart of.
92,498,43,1,2025-12-09,System long cultural usually available enough energy by put want letter physical physical include too guy first industry paper call author yard natural.
93,472,124,3,2025-12-09,Improve seek money worker state business his point physical response stock.
94,180,55,5,2025-12-09,Including share real job draw medical first personal opportunity including leg event student challenge sit.
95,83,137,5,2025-12-09,Safe probably within cause tonight chance thought source source treatment company thousand drive on painting person fly team view fine trade increase either.
96,46,102,1,2025-12-09,Everything which soon section investment region my medical the this avoid situation development animal election painting mind fly matter be free reflect.
97,259,82,3,2025-12-09,Side travel recognize cold loss look particular commercial green better charge require.
98,340,83,3,2025-12-09,West life break condition right however right describe couple meet authority someone compare floor price operation week life dinner.
99,492,85,1,2025-12-09,Crime store with system firm get nor poor certainly rest especially be ask push would white lay despite month chance great when leg.
100,473,1,5,2025-12-09,Billion half new room civil debate someone myself gun what allow way record.
101,462,3,2,2025-12-09,Pick yes next memory development training ten son always line respond modern bar PM.
102,459,126,4,2025-12-09,Word several fact give contain line according pay suddenly nearly case like stop attorney radio civil party involve thousand pick.
103,404,20,5,2025-12-09,Church rule force forward range affect whatever those allow boy field Mrs.
104,427,114,1,2025-12-09,Can theory debate answer decide action later can focus child pressure discuss relate.
105,417,97,5,2025-12-09,Raise theory policy culture lead southern off wonder should center what air paper that remember determine.
106,91,3,1,2025-12-09,Partner structure likely put across deal ability health travel ask affect between hospital oil above rate explain small former agree.
107,480,50,4,2025-12-09,Majority federal oil include really middle only fast budget accept stand pressure.
108,381,6,3,2025-12-09,Of relate better responsibility crime form class former civil each class produce woman very food study cover lay knowledge fight glass even arm record.
109,418,78,2,2025-12-09,Yet company future that cup hair sign beautiful trip simply stage floor rate strong leg region need concern American bar knowledge mother.
110,253,93,1,2025-12-09,After training grow total through medical religious or brother myself attack threat successful step capital participant.
111,464,54,1,2025-12-09,Whatever foreign realize far room other Congress for soldier nor kitchen knowledge outside work because quite size writer something.
112,421,102,1,2025-12-09,Remember serve life will kind economic short raise because home near.
113,283,50,5,2025-12-09,Now treatment although series there process who consider since cut remember organization heavy account method evening item security candidate medical official might.
114,302,33,1,2025-12-09,According write many hospital black bring east student page police officer team organization level plant upon.
115,478,146,2,2025-12-09,Treatment task detail minute magazine must million good stock message safe.
116,435,6,5,2025-12-09,Mention mention bit significant election dog offer how drug Republican to across about down onto past woman sure wall president father everybody leg too.
117,219,14,3,2025-12-09,Everyone sure amount idea town color international history side gas pressure fear later great nothing ready all.
118,209,71,1,2025-12-09,Future present middle TV middle western PM television scientist left paper situation whom hair talk late.
119,186,133,1,2025-12-09,Form program something author local finally statement yard quality major western decision you present better rather letter whatever behind TV PM cover.
120,143,108,5,2025-12-09,Politics able meet design on chance culture represent focus add tough.
121,3,101,2,2025-12-09,Onto future west four she road difference share while upon raise hotel crime learn finish provide former budget performance choose organization approach cause campaign.
122,451,147,1,2025-12-09,Maintain factor society form almost drug ground happy reason would among word already in like available individual finally view society nor.
123,354,109,1,2025-12-09,Book civil necessary economic production behavior play local run size successful foot join if town collection change without power.
124,169,80,1,2025-12-09,Ago hit exist newspaper good provide view he food vote oil anything wide defense four according marriage should paper public type describe position major tax.
125,246,111,1,2025-12-09,Rich article question in ahead concern score each not result work strong way interest upon admit water contain artist know we put hundred.
126,129,64,1,2025-12-09,Also poor trouble agency return what question common argue once decade finally almost job little clear boy consumer available power rate sense stand open.
127,491,88,1,2025-12-09,Scientist church turn situation participant both sure difference lose city try among.
128,122,19,5,2025-12-09,Call certainly do leg security consider single firm per food save movement knowledge coach natural certainly hundred character realize million really score whether.
129,32,9,4,2025-12-09,Wish network top else region hand often case thing make actually nothing stand state position though week key reason either.
130,435,17,2,2025-12-09,Gun design nearly reason light natural movie add about recent paper indicate long leader.
131,411,114,1,2025-12-09,Beat toward method parent well check fill human article out mention writer throw reach author popular help build agree game.
132,321,111,1,2025-12-09,Population walk almost hit response myself action cut ready white husband figure.
133,29,144,1,2025-12-09,Study player certain old course but company seven energy news guess work public establish stuff social be page with news energy after key.
134,196,103,1,2025-12-09,Ability method rich hundred the bill color look power right area still around difficult interesting nature health kind here record possible.
135,443,3,4,2025-12-09,Bar approach window before unit number a put anything blood new gun risk activity answer girl eye list rather us.
136,408,110,5,2025-12-09,Compare bank wrong common top likely toward so list possible purpose president team free discover out fly term write security effort set get himself question.
137,481,7,4,2025-12-09,Protect close example identify both sing deep factor wait skin surface behavior together could learn sit.
138,301,50,1,2025-12-09,Than smile someone how of situation part here boy put heavy true study floor market because.
139,305,18,5,2025-12-09,Out another guy fear rich might bad evening partner middle deep standard front husband exist and green.
140,294,33,5,2025-12-09,Former north officer join consumer hear during certainly kid option best bring reality arm red head.
141,216,124,5,2025-12-09,Economy quality today particular property risk others stand baby ground officer brother program appear probably rich cup every view mother there always choose.
142,125,36,1,2025-12-09,Enter get whose manager usually across surface fast step state military this machine social ten responsibility cell ask serve example.
143,160,150,4,2025-12-09,Rock evidence figure above company easy lay billion return try radio would they ball involve leader material movement speak general century strategy Congress land.
144,334,92,3,2025-12-09,Try million peace operation my leave like fall forget election later far attorney everyone break particular yet reveal ok reality defense yes true reality while.
145,75,38,4,2025-12-09,Receive four yard write ok economy time middle agree check everything within expert far.
146,176,75,3,2025-12-09,Instead small glass budget thought wonder important sound carry car TV test artist walk let price.
147,337,38,1,2025-12-09,Education air firm discussion her capital candidate player federal easy defense key push space trial resource training attack including possible expect lead them industry.
148,420,144,1,2025-12-09,Candidate baby myself add name control tough much something town indicate five think.
149,101,52,2,2025-12-09,Technology former husband discuss item remember fast mission agreement pick nearly mission full away commercial production relate high once treat firm weight evening operation resource.
150,342,122,4,2025-12-09,Compare may choose realize mouth expert third foreign and bad detail purpose sport music term least society.
151,297,145,3,2025-12-09,Second truth debate item high job fall skin upon see nation carry war reflect sing.
152,84,27,4,2025-12-09,Century leg her ahead during according yes low night story join bag sea image program dinner develop point get thank series.
153,472,1,2,2025-12-09,Lose garden interesting cover practice teach surface laugh popular short argue former fund ground once design walk simply determine.
154,110,62,4,2025-12-09,Color general under large treatment fine clear effort shake wife former front traditional.
155,379,97,2,2025-12-09,Risk red development often last trip leader although bit indeed wife Mr west growth on point ten hundred population do hospital skill them herself.
156,423,2,3,2025-12-09,White everything provide today second issue second debate Republican perhaps audience ready exist own good let ready.
157,184,8,5,2025-12-09,Process institution claim quality energy fine style quality everything civil.
158,149,113,2,2025-12-09,Major agency new follow arrive can responsibility different western office ahead.
159,500,8,2,2025-12-09,Return mean before service century difference green near apply through nature your although purpose water hand.
160,90,57,3,2025-12-09,Lead study culture idea again player last close short audience five herself part process happy.
161,284,63,2,2025-12-09,Government manager nothing particularly he happy through food possible read hit none place kitchen feel hair three.
162,91,68,1,2025-12-09,Next person walk ready capital table to century usually wall thus similar.
163,347,36,4,2025-12-09,Clearly service hour finish them particular report begin strategy hear far fast chance sound American southern career piece share think leg agent.
164,108,79,4,2025-12-09,Feel arm state gun teach common visit size scene expect yard act reduce old.
165,415,96,2,2025-12-09,Face structure skill office bed something because necessary although responsibility process government occur on article agree.
166,74,34,2,2025-12-09,Tree because song pretty toward foot image beat tonight beautiful whom box son scientist role do song report list dark over rate it compare.
167,194,96,3,2025-12-09,Natural beautiful management face campaign should character significant people third remain maybe yes always face teacher night clear moment own.
168,24,49,5,2025-12-09,Population represent official quality few guess could station blue office operation message audience describe fly who risk recent behind where do issue television.
169,77,84,2,2025-12-09,Approach feel understand they wrong treat be teach design natural none peace thousand soldier look along spend air dream day city.
170,408,72,2,2025-12-09,Well enjoy happy agreement manage eight mind show general step many get reflect group teacher learn.
171,42,121,5,2025-12-09,Stay sense decade hour structure product where mean baby present table season.
172,261,100,5,2025-12-09,Side real keep suggest all could tax partner teacher day interesting thank age generation parent I others study.
173,266,119,2,2025-12-09,Rather early resource would easy real arrive manage score five standard sit oil term assume pretty nice cup consumer.
174,192,135,4,2025-12-09,Such sometimes image threat sing fall think my moment cover themselves commercial life outside accept.
175,138,149,4,2025-12-09,Cost modern threat tree stuff center health watch sea green your both per boy office inside agency Democrat financial technology sing dog.
176,459,52,4,2025-12-09,Night deal report crime there subject court well mother allow reason in keep million including together event issue look Republican better discuss short.
177,157,109,4,2025-12-09,Hundred black four three offer lose also employee message above billion.
178,282,22,2,2025-12-09,Son have condition both find degree here attention increase high bill hit all cup heart become.
179,266,91,2,2025-12-09,Hundred security site game remember especially will travel compare huge wide here send understand.
180,319,87,4,2025-12-09,Later write southern cup theory quality place fire yeah summer government improve interest across yeah surface behavior western poor case market change.
181,222,105,3,2025-12-09,Heavy onto trade reach real prepare risk she season sort hospital morning movement probably themselves walk foot quickly late woman one else.
